{
    "$schema": "http://json-schema.org/draft-06/schema#",
    "$ref": "#/definitions/ItemClassesSchema",
    "definitions": {
        "ItemClassesSchema": {
            "type": "object",
            "additionalProperties": false,
            "properties": {
                "AbyssJewel": {
                    "$ref": "#/definitions/AbyssJewel"
                },
                "Active Skill Gem": {
                    "$ref": "#/definitions/AbyssJewel"
                },
                "Amulet": {
                    "$ref": "#/definitions/AbyssJewel"
                },
                "AnimalCharm": {
                    "$ref": "#/definitions/AbyssJewel"
                },
                "ArchnemesisMod": {
                    "$ref": "#/definitions/ArchnemesisMod"
                },
                "AtlasUpgradeItem": {
                    "$ref": "#/definitions/AbyssJewel"
                },
                "Belt": {
                    "$ref": "#/definitions/AbyssJewel"
                },
                "Body Armour": {
                    "$ref": "#/definitions/AbyssJewel"
                },
                "Boots": {
                    "$ref": "#/definitions/AbyssJewel"
                },
                "Bow": {
                    "$ref": "#/definitions/AbyssJewel"
                },
                "Breachstone": {
                    "$ref": "#/definitions/AbyssJewel"
                },
                "Claw": {
                    "$ref": "#/definitions/AbyssJewel"
                },
                "Currency": {
                    "$ref": "#/definitions/AbyssJewel"
                },
                "DONOTUSE1": {
                    "$ref": "#/definitions/ArchnemesisMod"
                },
                "DONOTUSE2": {
                    "$ref": "#/definitions/ArchnemesisMod"
                },
                "DONOTUSE3": {
                    "$ref": "#/definitions/ArchnemesisMod"
                },
                "DONOTUSE4": {
                    "$ref": "#/definitions/ArchnemesisMod"
                },
                "DONOTUSE5": {
                    "$ref": "#/definitions/ArchnemesisMod"
                },
                "DONOTUSE6": {
                    "$ref": "#/definitions/ArchnemesisMod"
                },
                "DONOTUSE7": {
                    "$ref": "#/definitions/ArchnemesisMod"
                },
                "Dagger": {
                    "$ref": "#/definitions/AbyssJewel"
                },
                "DelveSocketableCurrency": {
                    "$ref": "#/definitions/AbyssJewel"
                },
                "DelveStackableSocketableCurrency": {
                    "$ref": "#/definitions/AbyssJewel"
                },
                "DivinationCard": {
                    "$ref": "#/definitions/AbyssJewel"
                },
                "ExpeditionLogbook": {
                    "$ref": "#/definitions/AbyssJewel"
                },
                "FishingRod": {
                    "$ref": "#/definitions/AbyssJewel"
                },
                "GiftBox": {
                    "$ref": "#/definitions/ArchnemesisMod"
                },
                "Gloves": {
                    "$ref": "#/definitions/AbyssJewel"
                },
                "HeistBlueprint": {
                    "$ref": "#/definitions/AbyssJewel"
                },
                "HeistContract": {
                    "$ref": "#/definitions/AbyssJewel"
                },
                "HeistEquipmentReward": {
                    "$ref": "#/definitions/AbyssJewel"
                },
                "HeistEquipmentTool": {
                    "$ref": "#/definitions/AbyssJewel"
                },
                "HeistEquipmentUtility": {
                    "$ref": "#/definitions/AbyssJewel"
                },
                "HeistEquipmentWeapon": {
                    "$ref": "#/definitions/AbyssJewel"
                },
                "HeistObjective": {
                    "$ref": "#/definitions/AbyssJewel"
                },
                "Helmet": {
                    "$ref": "#/definitions/AbyssJewel"
                },
                "HiddenItem": {
                    "$ref": "#/definitions/ArchnemesisMod"
                },
                "HideoutDoodad": {
                    "$ref": "#/definitions/ArchnemesisMod"
                },
                "HybridFlask": {
                    "$ref": "#/definitions/AbyssJewel"
                },
                "Incubator": {
                    "$ref": "#/definitions/AbyssJewel"
                },
                "IncubatorStackable": {
                    "$ref": "#/definitions/AbyssJewel"
                },
                "IncursionItem": {
                    "$ref": "#/definitions/AbyssJewel"
                },
                "InstanceLocalItem": {
                    "$ref": "#/definitions/AbyssJewel"
                },
                "ItemisedCorpse": {
                    "$ref": "#/definitions/AbyssJewel"
                },
                "ItemisedSanctum": {
                    "$ref": "#/definitions/AbyssJewel"
                },
                "Jewel": {
                    "$ref": "#/definitions/AbyssJewel"
                },
                "LabyrinthItem": {
                    "$ref": "#/definitions/AbyssJewel"
                },
                "LabyrinthMapItem": {
                    "$ref": "#/definitions/AbyssJewel"
                },
                "LabyrinthTrinket": {
                    "$ref": "#/definitions/AbyssJewel"
                },
                "LargeRelic": {
                    "$ref": "#/definitions/ArchnemesisMod"
                },
                "Leaguestone": {
                    "$ref": "#/definitions/AbyssJewel"
                },
                "LifeFlask": {
                    "$ref": "#/definitions/AbyssJewel"
                },
                "ManaFlask": {
                    "$ref": "#/definitions/AbyssJewel"
                },
                "Map": {
                    "$ref": "#/definitions/AbyssJewel"
                },
                "MapFragment": {
                    "$ref": "#/definitions/AbyssJewel"
                },
                "MediumRelic": {
                    "$ref": "#/definitions/ArchnemesisMod"
                },
                "MemoryLine": {
                    "$ref": "#/definitions/AbyssJewel"
                },
                "MetamorphosisDNA": {
                    "$ref": "#/definitions/AbyssJewel"
                },
                "Microtransaction": {
                    "$ref": "#/definitions/ArchnemesisMod"
                },
                "MiscMapItem": {
                    "$ref": "#/definitions/AbyssJewel"
                },
                "NecropolisPack": {
                    "$ref": "#/definitions/AbyssJewel"
                },
                "One Hand Axe": {
                    "$ref": "#/definitions/AbyssJewel"
                },
                "One Hand Mace": {
                    "$ref": "#/definitions/AbyssJewel"
                },
                "One Hand Sword": {
                    "$ref": "#/definitions/AbyssJewel"
                },
                "PantheonSoul": {
                    "$ref": "#/definitions/AbyssJewel"
                },
                "QuestItem": {
                    "$ref": "#/definitions/AbyssJewel"
                },
                "Quiver": {
                    "$ref": "#/definitions/AbyssJewel"
                },
                "Relic": {
                    "$ref": "#/definitions/AbyssJewel"
                },
                "Ring": {
                    "$ref": "#/definitions/AbyssJewel"
                },
                "Rune Dagger": {
                    "$ref": "#/definitions/AbyssJewel"
                },
                "SanctumSpecialRelic": {
                    "$ref": "#/definitions/AbyssJewel"
                },
                "Sceptre": {
                    "$ref": "#/definitions/AbyssJewel"
                },
                "SentinelDrone": {
                    "$ref": "#/definitions/AbyssJewel"
                },
                "Shield": {
                    "$ref": "#/definitions/AbyssJewel"
                },
                "SmallRelic": {
                    "$ref": "#/definitions/ArchnemesisMod"
                },
                "StackableCurrency": {
                    "$ref": "#/definitions/AbyssJewel"
                },
                "Staff": {
                    "$ref": "#/definitions/AbyssJewel"
                },
                "Support Skill Gem": {
                    "$ref": "#/definitions/AbyssJewel"
                },
                "Thrusting One Hand Sword": {
                    "$ref": "#/definitions/AbyssJewel"
                },
                "Tincture": {
                    "$ref": "#/definitions/AbyssJewel"
                },
                "Trinket": {
                    "$ref": "#/definitions/AbyssJewel"
                },
                "Two Hand Axe": {
                    "$ref": "#/definitions/AbyssJewel"
                },
                "Two Hand Mace": {
                    "$ref": "#/definitions/AbyssJewel"
                },
                "Two Hand Sword": {
                    "$ref": "#/definitions/AbyssJewel"
                },
                "Unarmed": {
                    "$ref": "#/definitions/ArchnemesisMod"
                },
                "UniqueFragment": {
                    "$ref": "#/definitions/AbyssJewel"
                },
                "UniqueShard": {
                    "$ref": "#/definitions/ArchnemesisMod"
                },
                "UniqueShardBase": {
                    "$ref": "#/definitions/ArchnemesisMod"
                },
                "UtilityFlask": {
                    "$ref": "#/definitions/AbyssJewel"
                },
                "UtilityFlaskCritical": {
                    "$ref": "#/definitions/AbyssJewel"
                },
                "VaultKey": {
                    "$ref": "#/definitions/AbyssJewel"
                },
                "Wand": {
                    "$ref": "#/definitions/AbyssJewel"
                },
                "Warstaff": {
                    "$ref": "#/definitions/AbyssJewel"
                }
            },
            "required": [
                "AbyssJewel",
                "Active Skill Gem",
                "Amulet",
                "AnimalCharm",
                "ArchnemesisMod",
                "AtlasUpgradeItem",
                "Belt",
                "Body Armour",
                "Boots",
                "Bow",
                "Breachstone",
                "Claw",
                "Currency",
                "DONOTUSE1",
                "DONOTUSE2",
                "DONOTUSE3",
                "DONOTUSE4",
                "DONOTUSE5",
                "DONOTUSE6",
                "DONOTUSE7",
                "Dagger",
                "DelveSocketableCurrency",
                "DelveStackableSocketableCurrency",
                "DivinationCard",
                "ExpeditionLogbook",
                "FishingRod",
                "GiftBox",
                "Gloves",
                "HeistBlueprint",
                "HeistContract",
                "HeistEquipmentReward",
                "HeistEquipmentTool",
                "HeistEquipmentUtility",
                "HeistEquipmentWeapon",
                "HeistObjective",
                "Helmet",
                "HiddenItem",
                "HideoutDoodad",
                "HybridFlask",
                "Incubator",
                "IncubatorStackable",
                "IncursionItem",
                "InstanceLocalItem",
                "ItemisedCorpse",
                "ItemisedSanctum",
                "Jewel",
                "LabyrinthItem",
                "LabyrinthMapItem",
                "LabyrinthTrinket",
                "LargeRelic",
                "Leaguestone",
                "LifeFlask",
                "ManaFlask",
                "Map",
                "MapFragment",
                "MediumRelic",
                "MemoryLine",
                "MetamorphosisDNA",
                "Microtransaction",
                "MiscMapItem",
                "NecropolisPack",
                "One Hand Axe",
                "One Hand Mace",
                "One Hand Sword",
                "PantheonSoul",
                "QuestItem",
                "Quiver",
                "Relic",
                "Ring",
                "Rune Dagger",
                "SanctumSpecialRelic",
                "Sceptre",
                "SentinelDrone",
                "Shield",
                "SmallRelic",
                "StackableCurrency",
                "Staff",
                "Support Skill Gem",
                "Thrusting One Hand Sword",
                "Tincture",
                "Trinket",
                "Two Hand Axe",
                "Two Hand Mace",
                "Two Hand Sword",
                "Unarmed",
                "UniqueFragment",
                "UniqueShard",
                "UniqueShardBase",
                "UtilityFlask",
                "UtilityFlaskCritical",
                "VaultKey",
                "Wand",
                "Warstaff"
            ],
            "title": "ItemClassesSchema"
        },
        "AbyssJewel": {
            "type": "object",
            "additionalProperties": false,
            "properties": {
                "category": {
                    "type": "string"
                },
                "category_id": {
                    "type": "string"
                },
                "name": {
                    "type": "string"
                },
                "influence_tags": {
                    "type": "array",
                    "items": {
                        "type": "string"
                    }
                }
            },
            "required": [
                "category",
                "category_id",
                "name"
            ],
            "title": "AbyssJewel"
        },
        "ArchnemesisMod": {
            "type": "object",
            "additionalProperties": false,
            "properties": {
                "name": {
                    "type": "string"
                }
            },
            "required": [
                "name"
            ],
            "title": "ArchnemesisMod"
        }
    }
}
